movies_00000170	0	i want to buy movie tickets .		none	none	none	none	none
movies_00000170	1	i want to see avatar on wednesday at 2 pm at shoreline theater .	what date would you like ?	wednesday	avatar	none	shoreline theater	2 pm
movies_00000170	2	i want 2 tickets .	how many tickets would you like ?	wednesday	avatar	2	shoreline theater	2 pm
movies_00000170	3	ok , get the 6.15 pm tickets	2 pm is not available but there are shows at 6.15 pm and 6.30 pm .	wednesday	avatar	2	shoreline theater	6.15 pm
movies_00000170	4	thanks , see you later	ok , i bought 2 tickets for wednesday at 6.15 pm at shoreline theater for avatar .	wednesday	avatar	2	shoreline theater	6.15 pm
movies_00000171	0	i want to buy movie tickets to avatar		none	avatar	none	none	none
movies_00000171	1	yes	i found some movie tickets for avatar , is that what you wanted ?	none	avatar	none	none	none
movies_00000171	2	i ' d like 1 ticket for the 7.15 pm showing at angelika tonight .	what theater and how many tickets would you like ?	tonight	avatar	1	angelika	7.15 pm
movies_00000171	3	yes	okay , you would like to purchase 1 ticket for the angelika theatre for avatar at 7.15 pm tonight , right ?	tonight	avatar	1	angelika	7.15 pm
movies_00000171	4	bye !	okay , i have made the purchase .	tonight	avatar	1	angelika	7.15 pm
movies_00000172	0	please buy tickets for the movie avatar at the amc mercado theatre .		none	avatar	none	amc mercado	none
movies_00000172	1	tonight	what date do you want tickets for ?	tonight	avatar	none	amc mercado	none
movies_00000172	2	3 tickets for the 6 pm show	how many tickets and at what time ?	tonight	avatar	3	amc mercado	6 pm
movies_00000172	3	yes .	are you sure that you want 3 tickets for the 6 pm show ?	tonight	avatar	3	amc mercado	6 pm
movies_00000172	4	i do not want to go to the 6.15 pm show .	sorry , there is not a show at 6 pm . there is a show at 6.15 pm .	tonight	avatar	3	amc mercado	6 pm
movies_00000172	5	goodbye	i can not complete this purchase then .	tonight	avatar	3	amc mercado	6 pm
movies_00000173	0	please buy movie tickets for avatar at angelika theatre		none	avatar	none	angelika	none
movies_00000173	1	sunday for 3 people	what date and how many tickets ?	sunday	avatar	3	angelika	none
movies_00000173	2	yes	this sunday ?	sunday	avatar	3	angelika	none
movies_00000173	3	how about 6 pm	what time ?	sunday	avatar	3	angelika	6 pm
movies_00000173	4	7.30 pm is fine .	i couldn ' t find one for 6 pm , how about 7.30 pm ?	sunday	avatar	3	angelika	7.30 pm
movies_00000173	5	thank you very much , bye .	done . 3 tickets for avatar for sunday 7.30 pm at angelika	sunday	avatar	3	angelika	7.30 pm
movies_00000174	0	i would like to buy some movie tickets for avatar at the the angelika please .		none	avatar	none	angelika	none
movies_00000174	1	3 please	great , how many tickets would you like ?	none	avatar	3	angelika	none
movies_00000174	2	wednesday	thanks , and for what day ?	wednesday	avatar	3	angelika	none
movies_00000174	3	anytime is fine .	and for what time ?	wednesday	avatar	3	angelika	dontcare
movies_00000174	4	7.15 pm please	you can choose from 6.15 pm , 7.15 pm or 8.30 pm	wednesday	avatar	3	angelika	7.15 pm
movies_00000174	5	goodbye	i have you confirmed for 3 tickets to avatar at the angelika on wednesday at 7.15 pm	wednesday	avatar	3	angelika	7.15 pm
movies_00000177	0	can you buy one movie ticket for avatar that the angelika theatre .		none	avatar	none	angelika	none
movies_00000177	1	6 pm . just 1 ticket .	how many tickets do you want to buy and for what time ?	none	avatar	1	angelika	6 pm
movies_00000177	2	saturday	what date do you want to go ?	saturday	avatar	1	angelika	6 pm
movies_00000178	0	can you buy one movie ticket for avatar that the angelika theatre .		none	avatar	none	angelika	none
movies_00000178	1	6 pm . just 1 ticket .	how many tickets do you want to buy and for what time ?	none	avatar	1	angelika	6 pm
movies_00000178	2	saturday	what date do you want to go ?	saturday	avatar	1	angelika	6 pm
movies_00000184	0	can i buy movie tickets ?		none	none	none	none	none
movies_00000184	1	avatar at the stanford theater	sure , for what movie and at which theater ?	none	avatar	none	the stanford theater	none
movies_00000184	2	3 tickets for sunday at 7.15 pm	ok , how many tickets and which showing ?	sunday	avatar	3	the stanford theater	7.15 pm
movies_00000184	3	ok . bye !	sorry , no tickets seem to be available at that time	sunday	avatar	3	the stanford theater	7.15 pm
movies_00000188	0	hello , i ' d like to buy 3 movie tickets for cinelux plaza theatre for the 6:00 pm showing of boo! a madea halloween		none	boo! a madea halloween	3	cinelux plaza theatre	6:00 pm
movies_00000188	1	this coming wednesday	which date would you like tickets for ?	wednesday	boo! a madea halloween	3	cinelux plaza theatre	6:00 pm
movies_00000188	2	yes , that ' s correct	can you confirm that the time is at 6:00 pm ?	wednesday	boo! a madea halloween	3	cinelux plaza theatre	6:00 pm
movies_00000188	3	goodbye	purchase confirmed for 3 tickets to boo! a madea halloween on march march 08 at 6:00 pm at cinelux plaza theatre	wednesday	boo! a madea halloween	3	cinelux plaza theatre	6:00 pm
movies_00000190	0	i would like to buy 6 movie tickets .		none	none	6	none	none
movies_00000190	1	i want the amc cupertino square 16 at 6:00 pm .	please tell me the theater and time .	none	none	6	amc cupertino square 16	6:00 pm
movies_00000190	2	boo! a madea halloween for wednesday .	please provide the movie and date .	wednesday	boo! a madea halloween	6	amc cupertino square 16	6:00 pm
movies_00000190	3	yes , 6:00 pm .	please confirm the time is 6:00 pm .	wednesday	boo! a madea halloween	6	amc cupertino square 16	6:00 pm
movies_00000190	4	thank you .	purchase confirmed .	wednesday	boo! a madea halloween	6	amc cupertino square 16	6:00 pm
movies_00000191	0	hello . purchase 4 movie tickets to tonight ' s showing of boo! a madea halloween		tonight	boo! a madea halloween	4	none	none
movies_00000191	1	for the 6:00 pm show at the cinemark 12 downtown san mateo	what time and which theater ?	tonight	boo! a madea halloween	4	cinemark 12 downtown san mateo	6:00 pm
movies_00000191	2	that is correct	confirm the time is for the 6:00 pm show	tonight	boo! a madea halloween	4	cinemark 12 downtown san mateo	6:00 pm
movies_00000191	3	goodbye	i have purchased 4 tickets for the at 6:00 pm show at the cinemark 12 downtown san mateo for march 07 ' s showing of boo! a madea halloween	tonight	boo! a madea halloween	4	cinemark 12 downtown san mateo	6:00 pm
movies_00000195	0	please purchase 4 movie tickets for wednesday to see boo! a madea halloween at the amc saratoga 14 theater		wednesday	boo! a madea halloween	4	amc saratoga 14	none
movies_00000195	1	at 8:00 pm	what time	wednesday	boo! a madea halloween	4	amc saratoga 14	8:00 pm
movies_00000195	2	yes	8:00 pm is correct	wednesday	boo! a madea halloween	4	amc saratoga 14	8:00 pm
movies_00000195	3	thanks	okay 4 tickets for the 8:00 pm showing of boo! a madea halloween on march march 08 at the amc saratoga 14 was purchased	wednesday	boo! a madea halloween	4	amc saratoga 14	8:00 pm
movies_00000196	0	hi ! buy 6 movie tickets at amc cupertino square 16 at 6:00 pm .		none	none	6	amc cupertino square 16	6:00 pm
movies_00000196	1	for boo! a madea halloween on saturday .	for what movie and on what date ?	saturday	boo! a madea halloween	6	amc cupertino square 16	6:00 pm
movies_00000196	2	yes .	at 6:00 pm ?	saturday	boo! a madea halloween	6	amc cupertino square 16	6:00 pm
movies_00000196	3	goodbye .	please confirm that you would like 6 tickets to see boo! a madea halloween at 6:00 pm on march 11 at amc cupertino square 16 .	saturday	boo! a madea halloween	6	amc cupertino square 16	6:00 pm
movies_00000199	0	buy 6 movie tickets for boo! a madea halloween for saturday		saturday	boo! a madea halloween	6	none	none
movies_00000199	1	amc saratoga 14 at 6:00 pm	what time and theater ?	saturday	boo! a madea halloween	6	amc saratoga 14	6:00 pm
movies_00000199	2	yes at 6:00 pm	that was 6:00 pm , correct ?	saturday	boo! a madea halloween	6	amc saratoga 14	6:00 pm
movies_00000199	3	thanks	purchase confirmed for 6 tickets to boo! a madea halloween on march 11 at 6:00 pm at amc saratoga 14 .	saturday	boo! a madea halloween	6	amc saratoga 14	6:00 pm
movies_00000201	0	need to buy 4 movie tickets for 8:00 pm show		none	none	4	none	8:00 pm
movies_00000201	1	cinemark 12 downtown san mateo for movie boo! a madea halloween and for wednesday	which theater , which movie and what date ?	wednesday	boo! a madea halloween	4	cinemark 12 downtown san mateo	8:00 pm
movies_00000201	2	yes	did you say 8:00 pm ?	wednesday	boo! a madea halloween	4	cinemark 12 downtown san mateo	8:00 pm
movies_00000201	3	great and see you	done . bought 4 tickets to boo! a madea halloween in cinemark 12 downtown san mateo for 8:00 pm show .	wednesday	boo! a madea halloween	4	cinemark 12 downtown san mateo	8:00 pm
movies_00000203	0	buy movie 6 movie tickets for wednesday		wednesday	none	6	none	none
movies_00000203	1	certain women at amc mercado 20 for 6:00 pm	okay , what theater , movie and time were you looking at ?	wednesday	certain women	6	amc mercado 20	6:00 pm
movies_00000203	2	correct	please confirm the time of 6:00 pm	wednesday	certain women	6	amc mercado 20	6:00 pm
movies_00000203	3	thank you	okay . purchase is confirmed for 6 tickets for certain women at 6:00 pm on march 08 at amc mercado 20	wednesday	certain women	6	amc mercado 20	6:00 pm
movies_00000204	0	i need 6 tickets for certain women		none	certain women	6	none	none
movies_00000204	1	cinearts @ santana row on wednesday at 8:00 pm	what theater and showtime would you like ?	wednesday	certain women	6	cinearts @ santana row	8:00 pm
movies_00000204	2	yes	8:00 pm . is that correct ?	wednesday	certain women	6	cinearts @ santana row	8:00 pm
movies_00000204	3	thanks	that ' s 6 tickets for certain women at cinearts @ santana row on march 08 at 8:00 pm .	wednesday	certain women	6	cinearts @ santana row	8:00 pm
movies_00000205	0	hi ! i need tickets for wednesday at the amc cupertino square 16		wednesday	none	none	amc cupertino square 16	none
movies_00000205	1	4 for certain women	how many tickets and what movie would you like	wednesday	certain women	4	amc cupertino square 16	none
movies_00000205	2	8:00 pm	what showtime	wednesday	certain women	4	amc cupertino square 16	8:00 pm
movies_00000205	3	yes	confirm 8:00 pm showtime	wednesday	certain women	4	amc cupertino square 16	8:00 pm
movies_00000205	4	bye !	purchase confirmed for 4 tickets to see certain women on wednesday march march 08 at 8:00 pm at amc cupertino square 16	wednesday	certain women	4	amc cupertino square 16	8:00 pm
movies_00000206	0	i would like to buy movie tickets for the certain women at 4:00 pm		none	certain women	none	none	4:00 pm
movies_00000206	1	i need 6 tickets at camera 7	how many tickets and at what theatre	none	certain women	6	camera 7	4:00 pm
movies_00000206	2	wednesday	which day would you like ?	wednesday	certain women	6	camera 7	4:00 pm
movies_00000206	3	yes	4:00 pm wednesday , is this correct ?	wednesday	certain women	6	camera 7	4:00 pm
movies_00000206	4	thanks	the purchase of 6 tickets for the 4:00 pm showing of certain women at the camera 7 theater has been confirmed .	wednesday	certain women	6	camera 7	4:00 pm
movies_00000207	0	hi , i would like to purchase movie tickets for wednesday .		wednesday	none	none	none	none
movies_00000207	1	yes , the theater should be century cinemas 16 and the movie is certain women .	do you have a preference for the theater and movie ?	wednesday	certain women	none	century cinemas 16	none
movies_00000207	2	i would like 6 tickets for a 8:00 pm show .	how many tickets would you like and can you specify a time ?	wednesday	certain women	6	century cinemas 16	8:00 pm
movies_00000207	3	yes , the time is 8:00 pm .	can you confirm that the time is 8:00 pm ?	wednesday	certain women	6	century cinemas 16	8:00 pm
movies_00000207	4	thank you very much and that ' s all for now . bye !	i ' ve completed purchase of 6 tickets for the movie certain women starting at 8:00 pm on march march 08 at the theater century cinemas 16 . is that all ?	wednesday	certain women	6	century cinemas 16	8:00 pm
movies_00000212	0	hi . i would like to buy movie tickets for certain women .		none	certain women	none	none	none
movies_00000212	1	6 tickets at cinemark 12 downtown san mateo	ok . what theater and number of tickets ?	none	certain women	6	cinemark 12 downtown san mateo	none
movies_00000212	2	8:00 pm on wednesday	what time and date ?	wednesday	certain women	6	cinemark 12 downtown san mateo	8:00 pm
movies_00000212	3	yes	is 8:00 pm correct ?	wednesday	certain women	6	cinemark 12 downtown san mateo	8:00 pm
movies_00000212	4	thank you . goodbye .	6 tickets for certain women at 8:00 pm at cinemark 12 downtown san mateo is confirmed .	wednesday	certain women	6	cinemark 12 downtown san mateo	8:00 pm
movies_00000215	0	i want to buy 6 tickets to the movie certain women at cinemark 12 downtown san mateo		none	certain women	6	cinemark 12 downtown san mateo	none
movies_00000215	1	at 6:00 pm on wednesday	what time and date	wednesday	certain women	6	cinemark 12 downtown san mateo	6:00 pm
movies_00000215	2	please repeat , i did not understand .	ok , you want tickets for 6:00 pm ?	wednesday	certain women	6	cinemark 12 downtown san mateo	6:00 pm
movies_00000215	3	yes , 6:00 pm	did you say you wanted the 6:00 pm showing ?	wednesday	certain women	6	cinemark 12 downtown san mateo	6:00 pm
movies_00000215	4	ok , thank you , goodbye	ok , you have purchased 6 tickets to certain women on march march 08 at 6:00 pm at cinemark 12 downtown san mateo	wednesday	certain women	6	cinemark 12 downtown san mateo	6:00 pm
movies_00000219	0	buy movie tickets for deepwater horizon		none	deepwater horizon	none	none	none
movies_00000219	1	yes .	the movie is deepwater horizon , correct ?	none	deepwater horizon	none	none	none
movies_00000219	2	aquarius	which theater ?	none	deepwater horizon	none	aquarius	none
movies_00000219	3	yes , that ' s the right theater .	aquarius theater . is that correct ?	none	deepwater horizon	none	aquarius	none
movies_00000219	4	3 .	how many tickets ?	none	deepwater horizon	3	aquarius	none
movies_00000219	5	yes .	you want 3 tickets ?	none	deepwater horizon	3	aquarius	none
movies_00000219	6	i don ' t cate	what time ?	none	deepwater horizon	3	aquarius	dontcare
movies_00000219	7	tickets for tonight .	which day do you want the tickets for ?	tonight	deepwater horizon	3	aquarius	dontcare
movies_00000219	8	yes , that ' s right .	you want the tickets for tonight , right ?	tonight	deepwater horizon	3	aquarius	dontcare
movies_00000219	9	6 pm	would you like a showing at 6 pm , 7.30 pm , or 8 pm ?	tonight	deepwater horizon	3	aquarius	6 pm
movies_00000219	10	yes . thank you . bye !	you want 3 tickets for deepwater horizon at 6 pm tonight at aquarius theater , correct ?	tonight	deepwater horizon	3	aquarius	6 pm
movies_00000220	0	i would like to buy movie tickets for the movie deepwater horizon at angelika theater .		none	deepwater horizon	none	angelika	none
movies_00000220	1	yes	did you need tickets for deepwater horizon ?	none	deepwater horizon	none	angelika	none
movies_00000220	2	i need 2 tickets for 1 pm saturday .	what date and time are you reserving tickets for , and how many tickets do you need ?	saturday	deepwater horizon	2	angelika	1 pm
movies_00000220	3	no . thank you for trying .	i was unable to find available tickets for that time . would 6 pm , 6.15 pm , or 8 pm work for you ?	saturday	deepwater horizon	2	angelika	1 pm
movies_00000221	0	id like to get tickets for deepwater horizon		none	deepwater horizon	none	none	none
movies_00000221	1	1 ticket at aquarius movie theater .	how many ?	none	deepwater horizon	1	aquarius	none
movies_00000221	2	next monday at 7.15 pm	what day and time ?	next monday	deepwater horizon	1	aquarius	7.15 pm
movies_00000221	3	yes	next monday at 7.15 pm ?	next monday	deepwater horizon	1	aquarius	7.15 pm
movies_00000221	4	yes	okay . 1 ticket to deepwater horizon at aquarius theater next monday at 7.15 pm , correct ?	next monday	deepwater horizon	1	aquarius	7.15 pm
movies_00000221	5	goodbye	purchase confirmed .	next monday	deepwater horizon	1	aquarius	7.15 pm
movies_00000222	0	i want to buy movie ticket		none	none	none	none	none
movies_00000222	1	tomorrow and time doesn ' t matter	okay . what date and time ?	tomorrow	none	none	none	dontcare
movies_00000222	2	1 ticket at shoreline theater	okay . what theater and how many tickets ?	tomorrow	none	1	shoreline theater	dontcare
movies_00000222	3	deepwater horizon please	okay . which movie ?	tomorrow	deepwater horizon	1	shoreline theater	dontcare
movies_00000222	4	6.30 pm please	times available are 6.30 pm or 8 pm or 8.30 pm	tomorrow	deepwater horizon	1	shoreline theater	6.30 pm
movies_00000222	5	bye	okay , you have purchased 1 ticket at shoreline theater for the 6.30 pm showing of deepwater horizon tomorrow	tomorrow	deepwater horizon	1	shoreline theater	6.30 pm
movies_00000229	0	i want to buy a movie ticket to deepwater horizon .		none	deepwater horizon	none	none	none
movies_00000229	1	yes .	you want me to buy you a movie ticket for a showing of deepwater horizon ?	none	deepwater horizon	none	none	none
movies_00000229	2	i want 3 tickets for tonight at 6 pm .	what day , time and how many tickets do you need ?	tonight	deepwater horizon	3	none	6 pm
movies_00000229	3	i want to go to the shoreline theater .	what theater do you want to see the movie at ?	tonight	deepwater horizon	3	shoreline theater	6 pm
movies_00000229	4	i want the 5 pm showing	showings for 6 pm are not available . please choose from 5 pm , 7 pm , or 7.30 pm	tonight	deepwater horizon	3	shoreline theater	5 pm
movies_00000229	5	thanks ! bye !	your reservation is made for 3 tickets for tonight ' s showing of deepwater horizon at 5 pm at the shoreline theater .	tonight	deepwater horizon	3	shoreline theater	5 pm
movies_00000233	0	i need movie tickets		none	none	none	none	none
movies_00000233	1	3 for deepwater horizon at 2 pm	what movie for how many and what time	none	deepwater horizon	3	none	2 pm
movies_00000233	2	amc mercado	which theater	none	deepwater horizon	3	amc mercado	2 pm
movies_00000233	3	on wednesday	for what day	wednesday	deepwater horizon	3	amc mercado	2 pm
movies_00000233	4	7 pm is good	2 pm is unavailable how about 6.15 pm or 7 pm	wednesday	deepwater horizon	3	amc mercado	7 pm
movies_00000233	5	okay . bye !	all set for 3 at 7 pm on wednesday for deepwater horizon at amc mercado	wednesday	deepwater horizon	3	amc mercado	7 pm
movies_00000235	0	i want to buy tickets for the movie deepwater horizon on sunday at the shoreline theater .		sunday	deepwater horizon	none	shoreline theater	none
movies_00000235	1	yes , that ' s correct .	okay , the movie was deepwater horizon , correct ?	sunday	deepwater horizon	none	shoreline theater	none
movies_00000235	2	just 1 ticket .	okay , how many tickets did you want ?	sunday	deepwater horizon	1	shoreline theater	none
movies_00000235	3	8 pm is good .	what time would you prefer to see the movie ?	sunday	deepwater horizon	1	shoreline theater	8 pm
movies_00000235	4	yes .	is 8 pm the correct time ?	sunday	deepwater horizon	1	shoreline theater	8 pm
movies_00000235	5	yes , correct .	okay , so you want 1 ticket to see the movie deepwater horizon on sunday at 8 pm at shoreline theater . is this correct ?	sunday	deepwater horizon	1	shoreline theater	8 pm
movies_00000235	6	goodbye .	i ' ve confirmed purchase of 1 ticket to see deepwater horizon on sunday at 8 pm at shoreline theater .	sunday	deepwater horizon	1	shoreline theater	8 pm
movies_00000236	0	can you purchase tickets for deepwater horizon at the stanford theater		none	deepwater horizon	none	the stanford theater	none
movies_00000236	1	3 tickets	how many tickets ?	none	deepwater horizon	3	the stanford theater	none
movies_00000236	2	for tonight	for what date	tonight	deepwater horizon	3	the stanford theater	none
movies_00000236	3	yes tonight	so to confirm you want to purchase tickets for tonight	tonight	deepwater horizon	3	the stanford theater	none
movies_00000236	4	purchase for 6 pm	what time do you prefer	tonight	deepwater horizon	3	the stanford theater	6 pm
movies_00000236	5	yes 7.30 pm is fine	6 pm isn ' t available what about 5 pm or 7.30 pm	tonight	deepwater horizon	3	the stanford theater	7.30 pm
movies_00000236	6	thanks ! ok thank goodbye	ok i confirm a purchase of 3 tickets for deepwater horizon at the stanford theater tonight at 7.30 pm	tonight	deepwater horizon	3	the stanford theater	7.30 pm
movies_00000237	0	i ' d like to purchase tickets to see deepwater horizon		none	deepwater horizon	none	none	none
movies_00000237	1	angelika	for which theater ?	none	deepwater horizon	none	angelika	none
movies_00000237	2	yes , angelika .	you want them for angelika theater ?	none	deepwater horizon	none	angelika	none
movies_00000237	3	2 tickets for saturday	how many tickets would you like ?	saturday	deepwater horizon	2	angelika	none
movies_00000237	4	any time on saturday is fine	what time would you like ?	saturday	deepwater horizon	2	angelika	dontcare
movies_00000237	5	lets do 6.30 pm	okay , there is 6.15 pm , 6.30 pm or 8.30 pm	saturday	deepwater horizon	2	angelika	6.30 pm
movies_00000237	6	great ! ! bye !	okay , you have 2 tickets for saturday ' s 6.30 pm showing of deepwater horizon at the angelika theater	saturday	deepwater horizon	2	angelika	6.30 pm
movies_00000238	0	i would like to buy 6 movie tickets		none	none	6	none	none
movies_00000238	1	deepwater horizon at cinearts @ santana row	what movie and movie theatre would you like	none	deepwater horizon	6	cinearts @ santana row	none
movies_00000238	2	tuesday at 4:00 pm	what date and time	tuesday	deepwater horizon	6	cinearts @ santana row	4:00 pm
movies_00000238	3	yes	confirm this is for 4:00 pm	tuesday	deepwater horizon	6	cinearts @ santana row	4:00 pm
movies_00000238	4	thank you goodbye	purchase confirmed for 6 tickets to deepwater horizon on march 07 at 4:00 pm at cinearts @ santana row	tuesday	deepwater horizon	6	cinearts @ santana row	4:00 pm
movies_00000239	0	get tickets to deepwater horizon		none	deepwater horizon	none	none	none
movies_00000239	1	get the tickets at the amc mercado	what date would you like the tickets for ?	none	deepwater horizon	none	amc mercado	none
movies_00000239	2	get 2 tickets for friday	how many tickets do you need ?	friday	deepwater horizon	2	amc mercado	none
movies_00000239	3	2 pm	what time would you like ?	friday	deepwater horizon	2	amc mercado	2 pm
movies_00000239	4	i ' ll take 8 pm	2 pm isn ' t available . how about 5 pm , 7 pm or 8 pm	friday	deepwater horizon	2	amc mercado	8 pm
movies_00000239	5	thanks . bye !	purchase completed . 2 tickets to deepwater horizon on friday at 8 pm	friday	deepwater horizon	2	amc mercado	8 pm
movies_00000240	0	buy tickets for deepwater horizon playing at the stanford theater		none	deepwater horizon	none	the stanford theater	none
movies_00000240	1	yes	is that for deepwater horizon ?	none	deepwater horizon	none	the stanford theater	none
movies_00000240	2	next monday	what day would you like this for ?	next monday	deepwater horizon	none	the stanford theater	none
movies_00000240	3	yes	you would like that for next monday ?	next monday	deepwater horizon	none	the stanford theater	none
movies_00000240	4	2	how many tickets ?	next monday	deepwater horizon	2	the stanford theater	none
movies_00000240	5	1 pm	what time ?	next monday	deepwater horizon	2	the stanford theater	1 pm
movies_00000240	6	yes	for 1 pm ?	next monday	deepwater horizon	2	the stanford theater	1 pm
movies_00000240	7	cancel request , thank you	there is not a showing for 1 pm , but there is a 6 pm and 6.15 pm showing	next monday	deepwater horizon	2	the stanford theater	1 pm
movies_00000242	0	buy movie tickets		none	none	none	none	none
movies_00000242	1	deepwater horizon	what movie would you like to watch	none	deepwater horizon	none	none	none
movies_00000242	2	3	how many tickets	none	deepwater horizon	3	none	none
movies_00000242	3	yes	3 tickets correct ?	none	deepwater horizon	3	none	none
movies_00000242	4	the theatre name is shoreline theater and the date is sunday , time is 6 pm .	what day , time and theatre ?	sunday	deepwater horizon	3	shoreline theater	6 pm
movies_00000242	5	yes	to confirm , you want 3 tickets for sunday to watch deepwater horizon at 6 pm at shoreline theater	sunday	deepwater horizon	3	shoreline theater	6 pm
movies_00000242	6	thank you . bye !	your purchase is complete	sunday	deepwater horizon	3	shoreline theater	6 pm
movies_00000243	0	would like to buy movie tickets		none	none	none	none	none
movies_00000243	1	1 ticket please	how many tickets ?	none	none	1	none	none
movies_00000243	2	deepwater horizon at 1 pm	ok what movie and time ?	none	deepwater horizon	1	none	1 pm
movies_00000243	3	today	what date ?	today	deepwater horizon	1	none	1 pm
movies_00000243	4	angelika theatre	which theatre	today	deepwater horizon	1	angelika	1 pm
movies_00000243	5	yes	ok angelika theatre , correct ?	today	deepwater horizon	1	angelika	1 pm
movies_00000243	6	ok no thank you	no 1 pm showing is available , how about 5 pm or 6.15 pm	today	deepwater horizon	1	angelika	1 pm
movies_00000245	0	i want to buy tickets to deepwater horizon .		none	deepwater horizon	none	none	none
movies_00000245	1	that is correct , the movie is deepwater horizon .	please confirm the movie you wish to see is deepwater horizon .	none	deepwater horizon	none	none	none
movies_00000245	2	i want the 1 pm movie and i need 2 tickets .	what time do you want to see the movie and how many tickets are needed .	none	deepwater horizon	2	none	1 pm
movies_00000245	3	i want to go to lincoln square cinemas .	which theater do you wish to go to ?	none	deepwater horizon	2	lincoln square cinemas	1 pm
movies_00000245	4	that is correct .	please confirm that the name of the theater is lincoln square cinemas .	none	deepwater horizon	2	lincoln square cinemas	1 pm
